[
  {
    "id": "membership:eerste-kamer-a-j-m-van-kesteren",
    "organization": "org:eerste-kamer",
    "person": "person:a-j-m-van-kesteren",
    "seatNumber": null,
    "fractie": "PVV",
    "start": "2023-12-12",
    "end": null,
    "source": {
      "source": "src:ek-persoon-a-j-m-van-kesteren-pvv",
      "retrieved": "2026-09-17",
      "confidence": "high"
    }
  },
  {
    "id": "membership:eerste-kamer-a-kanis",
    "organization": "org:eerste-kamer",
    "person": "person:a-kanis",
    "seatNumber": null,
    "fractie": "D66",
    "start": "2025-11-18",
    "end": null,
    "source": {
      "source": "src:ek-persoon-a-kanis-d66",
      "retrieved": "2026-09-17",
      "confidence": "high"
    }
  },
  {
    "id": "membership:eerste-kamer-a-p-m-van-wijk",
    "organization": "org:eerste-kamer",
    "person": "person:a-p-m-van-wijk",
    "seatNumber": null,
    "fractie": "BBB",
    "start": "2023-06-13",
    "end": null,
    "source": {
      "source": "src:ek-persoon-a-p-m-van-wijk-bbb",
      "retrieved": "2026-09-17",
      "confidence": "high"
    }
  },
  {
    "id": "membership:eerste-kamer-a-w-j-a-van-hattem",
    "organization": "org:eerste-kamer",
    "person": "person:a-w-j-a-van-hattem",
    "seatNumber": null,
    "fractie": "PVV",
    "start": "2015-06-09",
    "end": null,
    "source": {
      "source": "src:ek-persoon-a-w-j-a-van-hattem-pvv",
      "retrieved": "2026-09-17",
      "confidence": "high"
    }
  },
  {
    "id": "membership:eerste-kamer-bgen-b-d-drs-a-j-a-beukering",
    "organization": "org:eerste-kamer",
    "person": "person:bgen-b-d-drs-a-j-a-beukering",
    "seatNumber": null,
    "fractie": "Fractie-Beukering",
    "start": "2025-11-18",
    "end": null,
    "source": {
      "source": "src:ek-persoon-bgen-b-d-drs-a-j-a-beukering",
      "retrieved": "2026-09-17",
      "confidence": "high"
    }
  },
  {
    "id": "membership:eerste-kamer-dr-d-m-g-roovers",
    "organization": "org:eerste-kamer",
    "person": "person:dr-d-m-g-roovers",
    "seatNumber": null,
    "fractie": "PRO",
    "start": "2023-06-13",
    "end": null,
    "source": {
      "source": "src:ek-persoon-dr-d-m-g-roovers-pro",
      "retrieved": "2026-09-17",
      "confidence": "high"
    }
  },
  {
    "id": "membership:eerste-kamer-dr-m-j-kaljouw",
    "organization": "org:eerste-kamer",
    "person": "person:dr-m-j-kaljouw",
    "seatNumber": null,
    "fractie": "VVD",
    "start": "2023-06-13",
    "end": null,
    "source": {
      "source": "src:ek-persoon-dr-m-j-kaljouw-vvd",
      "retrieved": "2026-09-17",
      "confidence": "high"
    }
  },
  {
    "id": "membership:eerste-kamer-dr-m-l-vos",
    "organization": "org:eerste-kamer",
    "person": "person:dr-m-l-vos",
    "seatNumber": null,
    "fractie": "PRO",
    "start": "2019-06-11",
    "end": null,
    "source": {
      "source": "src:ek-persoon-dr-m-l-vos-pro",
      "retrieved": "2026-09-17",
      "confidence": "high"
    }
  },
  {
    "id": "membership:eerste-kamer-dr-m-m-van-toorenburg",
    "organization": "org:eerste-kamer",
    "person": "person:dr-m-m-van-toorenburg",
    "seatNumber": null,
    "fractie": "CDA",
    "start": "2023-06-13",
    "end": null,
    "source": {
      "source": "src:ek-persoon-dr-m-m-van-toorenburg-cda",
      "retrieved": "2026-09-17",
      "confidence": "high"
    }
  },
  {
    "id": "membership:eerste-kamer-dr-mr-j-bakker-klein",
    "organization": "org:eerste-kamer",
    "person": "person:dr-mr-j-bakker-klein",
    "seatNumber": null,
    "fractie": "CDA",
    "start": "2023-06-13",
    "end": null,
    "source": {
      "source": "src:ek-persoon-dr-mr-j-bakker-klein-cda",
      "retrieved": "2026-09-17",
      "confidence": "high"
    }
  },
  {
    "id": "membership:eerste-kamer-dr-n-c-thijssen",
    "organization": "org:eerste-kamer",
    "person": "person:dr-n-c-thijssen",
    "seatNumber": null,
    "fractie": "PRO",
    "start": "2023-06-13",
    "end": null,
    "source": {
      "source": "src:ek-persoon-dr-n-c-thijssen-pro",
      "retrieved": "2026-09-17",
      "confidence": "high"
    }
  },
  {
    "id": "membership:eerste-kamer-dr-r-baumgarten",
    "organization": "org:eerste-kamer",
    "person": "person:dr-r-baumgarten",
    "seatNumber": null,
    "fractie": "JA21",
    "start": "2023-06-13",
    "end": null,
    "source": {
      "source": "src:ek-persoon-dr-r-baumgarten-ja21",
      "retrieved": "2026-09-17",
      "confidence": "high"
    }
  },
  {
    "id": "membership:eerste-kamer-drs-a-griffioen",
    "organization": "org:eerste-kamer",
    "person": "person:drs-a-griffioen",
    "seatNumber": null,
    "fractie": "D66",
    "start": "2023-06-13",
    "end": null,
    "source": {
      "source": "src:ek-persoon-drs-a-griffioen-d66",
      "retrieved": "2026-09-17",
      "confidence": "high"
    }
  },
  {
    "id": "membership:eerste-kamer-drs-a-sj-van-der-goot",
    "organization": "org:eerste-kamer",
    "person": "person:drs-a-sj-van-der-goot",
    "seatNumber": null,
    "fractie": "OPNL",
    "start": "2023-06-13",
    "end": null,
    "source": {
      "source": "src:ek-persoon-drs-a-sj-van-der-goot-opnl",
      "retrieved": "2026-09-17",
      "confidence": "high"
    }
  },
  {
    "id": "membership:eerste-kamer-drs-a-van-langen-visbeek",
    "organization": "org:eerste-kamer",
    "person": "person:drs-a-van-langen-visbeek",
    "seatNumber": null,
    "fractie": "BBB",
    "start": "2023-06-13",
    "end": null,
    "source": {
      "source": "src:ek-persoon-drs-a-van-langen-visbeek-bbb",
      "retrieved": "2026-09-17",
      "confidence": "high"
    }
  },
  {
    "id": "membership:eerste-kamer-drs-e-kemperman-mba",
    "organization": "org:eerste-kamer",
    "person": "person:drs-e-kemperman-mba",
    "seatNumber": null,
    "fractie": "FVD",
    "start": "2023-06-13",
    "end": null,
    "source": {
      "source": "src:ek-persoon-drs-e-kemperman-mba-fvd",
      "retrieved": "2026-09-17",
      "confidence": "high"
    }
  },
  {
    "id": "membership:eerste-kamer-drs-f-j-m-crone",
    "organization": "org:eerste-kamer",
    "person": "person:drs-f-j-m-crone",
    "seatNumber": null,
    "fractie": "PRO",
    "start": "2019-06-11",
    "end": null,
    "source": {
      "source": "src:ek-persoon-drs-f-j-m-crone-pro",
      "retrieved": "2026-09-17",
      "confidence": "high"
    }
  },
  {
    "id": "membership:eerste-kamer-drs-f-w-j-holterhues",
    "organization": "org:eerste-kamer",
    "person": "person:drs-f-w-j-holterhues",
    "seatNumber": null,
    "fractie": "ChristenUnie",
    "start": "2023-06-13",
    "end": null,
    "source": {
      "source": "src:ek-persoon-drs-f-w-j-holterhues-christenunie",
      "retrieved": "2026-09-17",
      "confidence": "high"
    }
  },
  {
    "id": "membership:eerste-kamer-drs-h-a-m-janssen-van-helvoort",
    "organization": "org:eerste-kamer",
    "person": "person:drs-h-a-m-janssen-van-helvoort",
    "seatNumber": null,
    "fractie": "PRO",
    "start": "2023-06-13",
    "end": null,
    "source": {
      "source": "src:ek-persoon-drs-h-a-m-janssen-van-helvoort-pro",
      "retrieved": "2026-09-17",
      "confidence": "high"
    }
  },
  {
    "id": "membership:eerste-kamer-drs-h-j-meijer",
    "organization": "org:eerste-kamer",
    "person": "person:drs-h-j-meijer",
    "seatNumber": null,
    "fractie": "VVD",
    "start": "2019-06-11",
    "end": null,
    "source": {
      "source": "src:ek-persoon-drs-h-j-meijer-vvd",
      "retrieved": "2026-09-17",
      "confidence": "high"
    }
  },
  {
    "id": "membership:eerste-kamer-drs-ing-b-kroon",
    "organization": "org:eerste-kamer",
    "person": "person:drs-ing-b-kroon",
    "seatNumber": null,
    "fractie": "BBB",
    "start": "2023-06-13",
    "end": null,
    "source": {
      "source": "src:ek-persoon-drs-ing-b-kroon-bbb",
      "retrieved": "2026-09-17",
      "confidence": "high"
    }
  },
  {
    "id": "membership:eerste-kamer-drs-ing-t-panman",
    "organization": "org:eerste-kamer",
    "person": "person:drs-ing-t-panman",
    "seatNumber": null,
    "fractie": "BBB",
    "start": "2023-06-13",
    "end": null,
    "source": {
      "source": "src:ek-persoon-drs-ing-t-panman-bbb",
      "retrieved": "2026-09-17",
      "confidence": "high"
    }
  },
  {
    "id": "membership:eerste-kamer-drs-k-c-j-straus",
    "organization": "org:eerste-kamer",
    "person": "person:drs-k-c-j-straus",
    "seatNumber": null,
    "fractie": "VVD",
    "start": "2025-07-01",
    "end": null,
    "source": {
      "source": "src:ek-persoon-drs-k-c-j-straus-vvd",
      "retrieved": "2026-09-17",
      "confidence": "high"
    }
  },
  {
    "id": "membership:eerste-kamer-drs-k-petersen",
    "organization": "org:eerste-kamer",
    "person": "person:drs-k-petersen",
    "seatNumber": null,
    "fractie": "VVD",
    "start": "2023-06-13",
    "end": null,
    "source": {
      "source": "src:ek-persoon-drs-k-petersen-vvd",
      "retrieved": "2026-09-17",
      "confidence": "high"
    }
  },
  {
    "id": "membership:eerste-kamer-drs-m-c-t-fiers",
    "organization": "org:eerste-kamer",
    "person": "person:drs-m-c-t-fiers",
    "seatNumber": null,
    "fractie": "PRO",
    "start": "2021-10-12",
    "end": null,
    "source": {
      "source": "src:ek-persoon-drs-m-c-t-fiers-pro",
      "retrieved": "2026-09-17",
      "confidence": "high"
    }
  },
  {
    "id": "membership:eerste-kamer-drs-m-j-van-rooijen",
    "organization": "org:eerste-kamer",
    "person": "person:drs-m-j-van-rooijen",
    "seatNumber": null,
    "fractie": "50PLUS",
    "start": "2019-06-11",
    "end": null,
    "source": {
      "source": "src:ek-persoon-drs-m-j-van-rooijen-50plus",
      "retrieved": "2026-09-17",
      "confidence": "high"
    }
  },
  {
    "id": "membership:eerste-kamer-drs-n-k-koffeman",
    "organization": "org:eerste-kamer",
    "person": "person:drs-n-k-koffeman",
    "seatNumber": null,
    "fractie": "PvdD",
    "start": "2007-06-12",